url,title,github-author,github-link,date,abstract,star,tasks
https://paperswithcode.com/paper/openrlhf-an-easy-to-use-scalable-and-high,"OpenRLHF: An Easy-to-use, Scalable and High-performance RLHF Framework",OpenLLMAI/OpenRLHF,https://github.com/OpenLLMAI/OpenRLHF,20 May 2024,"However, unlike pretraining or fine-tuning a single model, scaling reinforcement learning from human feedback (RLHF) for training large language models poses coordination challenges across four models.","1,532","Scheduling,reinforcement-learning"
https://paperswithcode.com/paper/improving-diffusion-models-for-virtual-try-on,Improving Diffusion Models for Virtual Try-on,yisol/IDM-VTON,https://github.com/yisol/IDM-VTON,8 Mar 2024,"Finally, we present a customization method using a pair of person-garment images, which significantly improves fidelity and authenticity.","2,787",Virtual Try-on
https://paperswithcode.com/paper/relu-kan-new-kolmogorov-arnold-networks-that,"ReLU-KAN: New Kolmogorov-Arnold Networks that Only Need Matrix Addition, Dot Multiplication, and ReLU",quiqi/relu_kan,https://github.com/quiqi/relu_kan,4 Jun 2024,"Limited by the complexity of basis function (B-spline) calculations, Kolmogorov-Arnold Networks (KAN) suffer from restricted parallel computing capability on GPUs.",27,Other
https://paperswithcode.com/paper/dreamphysics-learning-physical-properties-of,DreamPhysics: Learning Physical Properties of Dynamic 3D Gaussians with Video Diffusion Priors,tyhuang0428/dreamphysics,https://github.com/tyhuang0428/dreamphysics,3 Jun 2024,"One solution is to animate 3D scenes with physics-based simulation, and the other is to learn the deformation of static 3D objects with the distillation of video generative models.",137,Other
https://paperswithcode.com/paper/sayself-teaching-llms-to-express-confidence,SaySelf: Teaching LLMs to Express Confidence with Self-Reflective Rationales,xu1868/sayself,https://github.com/xu1868/sayself,31 May 2024,"Large language models (LLMs) often generate inaccurate or fabricated information and generally fail to indicate their confidence, which limits their broader applications.",46,Other
https://paperswithcode.com/paper/vista-a-generalizable-driving-world-model,Vista: A Generalizable Driving World Model with High Fidelity and Versatile Controllability,opendrivelab/vista,https://github.com/opendrivelab/vista,27 May 2024,"In this paper, we present Vista, a generalizable driving world model with high fidelity and versatile controllability.",302,"Video Generation,Autonomous Driving"
https://paperswithcode.com/paper/demonstration-of-db-gpt-next-generation-data,Demonstration of DB-GPT: Next Generation Data Interaction System Empowered by Large Language Models,eosphoros-ai/db-gpt,https://github.com/eosphoros-ai/db-gpt,16 Apr 2024,The recent breakthroughs in large language models (LLMs) are positioned to transition many areas of software.,"11,821","Text-To-SQL,Data Interaction"
https://paperswithcode.com/paper/xrec-large-language-models-for-explainable,XRec: Large Language Models for Explainable Recommendation,hkuds/xrec,https://github.com/hkuds/xrec,4 Jun 2024,"We introduce a model-agnostic framework called XRec, which enables LLMs to provide comprehensive explanations for user behaviors in recommender systems.",30,"Decision Making,Collaborative Filtering"
https://paperswithcode.com/paper/zerosmooth-training-free-diffuser-adaptation,ZeroSmooth: Training-free Diffuser Adaptation for High Frame Rate Video Generation,ssyang2020/ZeroSmooth,https://github.com/ssyang2020/ZeroSmooth,3 Jun 2024,Previous methods promote the frame rate by either training a video interpolation model in pixel space as a postprocessing stage or training an interpolation model in latent space for a specific base video model.,51,Video Generation
https://paperswithcode.com/paper/fredf-learning-to-forecast-in-frequency,FreDF: Learning to Forecast in Frequency Domain,master-plc/fredf,https://github.com/master-plc/fredf,4 Feb 2024,Time series modeling is uniquely challenged by the presence of autocorrelation in both historical and label sequences.,20,Time Series
https://paperswithcode.com/paper/ufo-a-ui-focused-agent-for-windows-os,UFO: A UI-Focused Agent for Windows OS Interaction,microsoft/UFO,https://github.com/microsoft/UFO,8 Feb 2024,"We introduce UFO, an innovative UI-Focused agent to fulfill user requests tailored to applications on Windows OS, harnessing the capabilities of GPT-Vision.","5,648",Navigate
https://paperswithcode.com/paper/sparsedrive-end-to-end-autonomous-driving-via,SparseDrive: End-to-End Autonomous Driving via Sparse Scene Representation,swc-17/sparsedrive,https://github.com/swc-17/sparsedrive,30 May 2024,"To this end, we explore the sparse representation and review the task design for end-to-end autonomous driving, proposing a new paradigm named SparseDrive.",81,"Autonomous Driving,Attribute"
https://paperswithcode.com/paper/sparsectrl-adding-sparse-controls-to-text-to,SparseCtrl: Adding Sparse Controls to Text-to-Video Diffusion Models,guoyww/animatediff,https://github.com/guoyww/animatediff,28 Nov 2023,"The development of text-to-video (T2V), i. e., generating videos with a given text prompt, has been significantly advanced in recent years.","9,459",Video Generation
https://paperswithcode.com/paper/emotion2vec-self-supervised-pre-training-for,emotion2vec: Self-Supervised Pre-Training for Speech Emotion Representation,alibaba-damo-academy/FunASR,https://github.com/alibaba-damo-academy/FunASR,23 Dec 2023,"To the best of our knowledge, emotion2vec is the first universal representation model in various emotion-related tasks, filling a gap in the field.","4,126","Sentiment Analysis,Self-Supervised Learning"
https://paperswithcode.com/paper/llamp-large-language-model-made-powerful-for,LLaMP: Large Language Model Made Powerful for High-fidelity Materials Knowledge Retrieval and Distillation,chiang-yuan/llamp,https://github.com/chiang-yuan/llamp,30 Jan 2024,"Reducing hallucination of Large Language Models (LLMs) is imperative for use in the sciences, where reliability and reproducibility are crucial.",33,"Knowledge Distillation,Hallucination"
https://paperswithcode.com/paper/minicpm-unveiling-the-potential-of-small,MiniCPM: Unveiling the Potential of Small Language Models with Scalable Training Strategies,openbmb/minicpm,https://github.com/openbmb/minicpm,9 Apr 2024,"For data scaling, we introduce a Warmup-Stable-Decay (WSD) learning rate scheduler (LRS), conducive to continuous training and domain adaptation.","4,225",Domain Adaptation
https://paperswithcode.com/paper/lw-detr-a-transformer-replacement-to-yolo-for,LW-DETR: A Transformer Replacement to YOLO for Real-Time Detection,atten4vis/lw-detr,https://github.com/atten4vis/lw-detr,5 Jun 2024,"In this paper, we present a light-weight detection transformer, LW-DETR, which outperforms YOLOs for real-time object detection.",22,"object-detection,Decoder"
https://paperswithcode.com/paper/parameter-inverted-image-pyramid-networks,Parameter-Inverted Image Pyramid Networks,opengvlab/piip,https://github.com/opengvlab/piip,6 Jun 2024,"Our core idea is to use models with different parameter sizes to process different resolution levels of the image pyramid, thereby balancing computational efficiency and performance.",21,"Image Classification,Computational Efficiency"
https://paperswithcode.com/paper/faithful-logical-reasoning-via-symbolic-chain,Faithful Logical Reasoning via Symbolic Chain-of-Thought,aiden0526/symbcot,https://github.com/aiden0526/symbcot,28 May 2024,"Technically, building upon an LLM, SymbCoT 1) first translates the natural language context into the symbolic format, and then 2) derives a step-by-step plan to solve the problem with symbolic logical rules, 3) followed by a verifier to check the translation and reasoning chain.",78,Logical Reasoning
https://paperswithcode.com/paper/making-images-real-again-a-comprehensive,Making Images Real Again: A Comprehensive Survey on Deep Image Composition,bcmi/Awesome-Image-Composition,https://github.com/bcmi/Awesome-Image-Composition,28 Jun 2021,"We have also contributed the first image composition toolbox: libcom https://github. com/bcmi/libcom, which assembles 10+ image composition related functions (e. g., image blending, image harmonization, object placement, shadow generation, generative composition).",897,Image Harmonization
https://paperswithcode.com/paper/masknet-introducing-feature-wise,MaskNet: Introducing Feature-Wise Multiplication to CTR Ranking Models by Instance-Guided Mask,UlionTse/mlgb,https://github.com/UlionTse/mlgb/blob/main/mlgb/torch/models/ranking.py,9 Feb 2021,We also turn the feed-forward layer in DNN model into a mixture of addictive and multiplicative feature interactions by proposing MaskBlock in this paper.,367,"Recommendation Systems,Click-Through Rate Prediction"
https://paperswithcode.com/paper/once-for-all-controllable-generative-image,Once-for-All: Controllable Generative Image Compression with Dynamic Granularity Adaption,lianqi1008/Control-GIC,https://github.com/lianqi1008/Control-GIC,2 Jun 2024,"To overcome this challenge, this paper proposes a Controllable Generative Image Compression framework, Control-GIC, the first capable of fine-grained bitrate adaption across a broad spectrum while ensuring high-fidelity and generality compression.",27,Image Compression
https://paperswithcode.com/paper/pepnet-parameter-and-embedding-personalized,PEPNet: Parameter and Embedding Personalized Network for Infusing with Personalized Prior Information,UlionTse/mlgb,https://github.com/UlionTse/mlgb,2 Feb 2023,"By infusing personalized selection of Embedding and personalized modification of DNN parameters, PEPNet tailored to the interests of each individual obtains significant performance gains, with online improvements exceeding 1\% in multiple task metrics across multiple domains.",367,Recommendation Systems
https://paperswithcode.com/paper/grokfast-accelerated-grokking-by-amplifying,Grokfast: Accelerated Grokking by Amplifying Slow Gradients,ironjr/grokfast,https://github.com/ironjr/grokfast,30 May 2024,One puzzling artifact in machine learning dubbed grokking is where delayed generalization is achieved tenfolds of iterations after near perfect overfitting to the training data.,53,Other
https://paperswithcode.com/paper/nerf-on-the-go-exploiting-uncertainty-for,NeRF On-the-go: Exploiting Uncertainty for Distractor-free NeRFs in the Wild,cvg/nerf-on-the-go,https://github.com/cvg/nerf-on-the-go,29 May 2024,"Neural Radiance Fields (NeRFs) have shown remarkable success in synthesizing photorealistic views from multi-view images of static scenes, but face challenges in dynamic, real-world environments with distractors like moving objects, shadows, and lighting changes.",74,Other
https://paperswithcode.com/paper/deepseek-v2-a-strong-economical-and-efficient,"DeepSeek-V2: A Strong, Economical, and Efficient Mixture-of-Experts Language Model",deepseek-ai/deepseek-v2,https://github.com/deepseek-ai/deepseek-v2,7 May 2024,"MLA guarantees efficient inference through significantly compressing the Key-Value (KV) cache into a latent vector, while DeepSeekMoE enables training strong models at an economical cost through sparse computation.","2,476","Reinforcement Learning (RL),Language Modelling"
https://paperswithcode.com/paper/nvs-solver-video-diffusion-model-as-zero-shot,NVS-Solver: Video Diffusion Model as Zero-Shot Novel View Synthesizer,zhu-zhiyu/nvs_solver,https://github.com/zhu-zhiyu/nvs_solver,24 May 2024,"By harnessing the potent generative capabilities of pre-trained large video diffusion models, we propose NVS-Solver, a new novel view synthesis (NVS) paradigm that operates \textit{without} the need for training.",144,Novel View Synthesis
https://paperswithcode.com/paper/the-unreasonable-effectiveness-of-eccentric,The Unreasonable Effectiveness of Eccentric Automatic Prompts,stanfordnlp/dspy,https://github.com/stanfordnlp/dspy,9 Feb 2024,"Given the combinatorial complexity, and thus computation time, of experimenting with hand-tuning prompts for large black-box models, we then compared the performance of the best ""positive thinking"" prompt against the output of systematic prompt optimization.","12,522","GSM8K,Arithmetic Reasoning"
https://paperswithcode.com/paper/efficient-guided-generation-for-llms,Efficient Guided Generation for Large Language Models,normal-computing/outlines,https://github.com/normal-computing/outlines,19 Jul 2023,In this article we show how the problem of neural text generation can be constructively reformulated in terms of transitions between the states of a finite-state machine.,"6,521","Text Generation,Language Modelling"
https://paperswithcode.com/paper/assisting-in-writing-wikipedia-like-articles,Assisting in Writing Wikipedia-like Articles From Scratch with Large Language Models,assafelovic/gpt-researcher,https://github.com/assafelovic/gpt-researcher,22 Feb 2024,"We study how to apply large language models to write grounded and organized long-form articles from scratch, with comparable breadth and depth to Wikipedia pages.","12,531",Retrieval
https://paperswithcode.com/paper/graphany-a-foundation-model-for-node,GraphAny: A Foundation Model for Node Classification on Any Graph,deepgraphlearning/graphany,https://github.com/deepgraphlearning/graphany,30 May 2024,Traditional graph ML models such as graph neural networks (GNNs) trained on graphs cannot perform inference on a new graph with feature and label spaces different from the training ones.,58,Node Classification
https://paperswithcode.com/paper/direct-3d-learning-direct-text-to-3d,DIRECT-3D: Learning Direct Text-to-3D Generation on Massive Noisy 3D Data,qihao067/direct3d,https://github.com/qihao067/direct3d,6 Jun 2024,"Unlike recent 3D generative models that rely on clean and well-aligned 3D data, limiting them to single or few-class generation, our model is directly trained on extensive noisy and unaligned `in-the-wild' 3D assets, mitigating the key challenge (i. e., data scarcity) in large-scale 3D generation.",14,"Text to 3D,3D Generation"
https://paperswithcode.com/paper/learning-1d-causal-visual-representation-with,Learning 1D Causal Visual Representation with De-focus Attention Networks,opengvlab/de-focus-attention-networks,https://github.com/opengvlab/de-focus-attention-networks,6 Jun 2024,"The issue of ""over-focus"" hinders the model's ability to extract diverse visual features and to receive effective gradients for optimization.",16,Other
https://paperswithcode.com/paper/do-anything-now-characterizing-and-evaluating,"""Do Anything Now"": Characterizing and Evaluating In-The-Wild Jailbreak Prompts on Large Language Models",verazuo/jailbreak_llms,https://github.com/verazuo/jailbreak_llms,7 Aug 2023,We hope that our study can facilitate the research community and LLM vendors in promoting safer and regulated LLMs.,299,Community Detection
https://paperswithcode.com/paper/flashrag-a-modular-toolkit-for-efficient,FlashRAG: A Modular Toolkit for Efficient Retrieval-Augmented Generation Research,ruc-nlpir/flashrag,https://github.com/ruc-nlpir/flashrag,22 May 2024,"With the advent of Large Language Models (LLMs), the potential of Retrieval Augmented Generation (RAG) techniques have garnered considerable research attention.",725,Retrieval
https://paperswithcode.com/paper/what-makes-good-in-context-examples-for-gpt-3,What Makes Good In-Context Examples for GPT-$3$?,stanfordnlp/dsp,https://github.com/stanfordnlp/dsp,17 Jan 2021,"Inspired by the recent success of leveraging a retrieval module to augment large-scale neural network models, we propose to retrieve examples that are semantically-similar to a test sample to formulate its corresponding prompt.","12,532","Natural Language Understanding,Few-Shot Learning"
https://paperswithcode.com/paper/inf-dit-upsampling-any-resolution-image-with,Inf-DiT: Upsampling Any-Resolution Image with Memory-Efficient Diffusion Transformer,thudm/inf-dit,https://github.com/thudm/inf-dit,7 May 2024,"However, due to a quadratic increase in memory during generating ultra-high-resolution images (e. g. 4096*4096), the resolution of generated images is often limited to 1024*1024.",208,"Super-Resolution,Image Generation"
https://paperswithcode.com/paper/mistral-7b,Mistral 7B,skypilot-org/skypilot,https://github.com/skypilot-org/skypilot,10 Oct 2023,"We introduce Mistral 7B v0. 1, a 7-billion-parameter language model engineered for superior performance and efficiency.","6,041","Chatbot,Arithmetic Reasoning"
https://paperswithcode.com/paper/anytool-self-reflective-hierarchical-agents,"AnyTool: Self-Reflective, Hierarchical Agents for Large-Scale API Calls",dyabel/anytool,https://github.com/dyabel/anytool,6 Feb 2024,We also revisit the evaluation protocol introduced by previous works and identify a limitation in this protocol that leads to an artificially high pass rate.,188,"Large Language Model,Language Modelling"
https://paperswithcode.com/paper/training-language-models-to-follow,Training language models to follow instructions with human feedback,hiyouga/llama-efficient-tuning,https://github.com/hiyouga/llama-efficient-tuning,4 Mar 2022,"In this paper, we show an avenue for aligning language models with user intent on a wide range of tasks by fine-tuning with human feedback.","23,960",Other
https://paperswithcode.com/paper/freb-tqa-a-fine-grained-robustness-evaluation,FREB-TQA: A Fine-Grained Robustness Evaluation Benchmark for Table Question Answering,hiyouga/llama-factory,https://github.com/hiyouga/llama-factory,29 Apr 2024,"To investigate these aspects, we create and publish a novel TQA evaluation benchmark in English.","23,955",Question Answering
https://paperswithcode.com/paper/simpo-simple-preference-optimization-with-a,SimPO: Simple Preference Optimization with a Reference-Free Reward,princeton-nlp/simpo,https://github.com/princeton-nlp/simpo,23 May 2024,"Our top-performing model, built on Llama3-8B-Instruct, achieves a remarkable 44. 7 length-controlled win rate on AlpacaEval 2 -- surpassing Claude 3 Opus on the leaderboard, and a 33. 8 win rate on Arena-Hard -- making it the strongest 8B open-source model.",409,Instruction Following
https://paperswithcode.com/paper/2309-06180,Efficient Memory Management for Large Language Model Serving with PagedAttention,vllm-project/vllm,https://github.com/vllm-project/vllm,12 Sep 2023,"On top of it, we build vLLM, an LLM serving system that achieves (1) near-zero waste in KV cache memory and (2) flexible sharing of KV cache within and across requests to further reduce memory usage.","20,731","Large Language Model,Language Modelling"
https://paperswithcode.com/paper/learning-to-cache-accelerating-diffusion,Learning-to-Cache: Accelerating Diffusion Transformer via Layer Caching,horseee/learning-to-cache,https://github.com/horseee/learning-to-cache,3 Jun 2024,"To address the challenge of the exponential search space in deep models for identifying layers to cache and remove, we propose a novel differentiable optimization objective.",27,Denoising
https://paperswithcode.com/paper/prometheus-inducing-fine-grained-evaluation,Prometheus: Inducing Fine-grained Evaluation Capability in Language Models,stanford-oval/storm,https://github.com/stanford-oval/storm,12 Oct 2023,"We first construct the Feedback Collection, a new dataset that consists of 1K fine-grained score rubrics, 20K instructions, and 100K responses and language feedback generated by GPT-4.","4,619","Large Language Model,Language Modelling"
https://paperswithcode.com/paper/mmbench-is-your-multi-modal-model-an-all,MMBench: Is Your Multi-modal Model an All-around Player?,InternLM/opencompass,https://github.com/InternLM/opencompass,12 Jul 2023,"In response to these challenges, we propose MMBench, a novel multi-modality benchmark.","2,948",Visual Question Answering
https://paperswithcode.com/paper/video-understanding-with-large-language,Video Understanding with Large Language Models: A Survey,yunlong10/awesome-llms-for-video-understanding,https://github.com/yunlong10/awesome-llms-for-video-understanding,29 Dec 2023,"With the burgeoning growth of online video platforms and the escalating volume of video content, the demand for proficient video understanding tools has intensified markedly.",805,Video Understanding
https://paperswithcode.com/paper/improved-distribution-matching-distillation,Improved Distribution Matching Distillation for Fast Image Synthesis,tianweiy/DMD2,https://github.com/tianweiy/DMD2,23 May 2024,Recent approaches have shown promises distilling diffusion models into efficient one-step generators.,254,Image Generation
https://paperswithcode.com/paper/gens-generalizable-neural-surface-1,GenS: Generalizable Neural Surface Reconstruction from Multi-View Images,prstrive/gens,https://github.com/prstrive/gens,,"Meanwhile, we introduce a multi-scale feature-metric consistency to impose the multi-view consistency in a more discriminative multi-scale feature space, which is robust to the failures of the photometric consistency.",26,Surface Reconstruction
https://paperswithcode.com/paper/mora-enabling-generalist-video-generation-via,Mora: Enabling Generalist Video Generation via A Multi-Agent Framework,lichao-sun/mora,https://github.com/lichao-sun/mora,20 Mar 2024,Sora is the first large-scale generalist video generation model that garnered significant attention across society.,"1,398","Text-to-Video Generation,Image to Video Generation"
https://paperswithcode.com/paper/the-benefits-of-a-concise-chain-of-thought-on,The Benefits of a Concise Chain of Thought on Problem-Solving in Large Language Models,matthewrenze/jhu-concise-cot,https://github.com/matthewrenze/jhu-concise-cot,11 Jan 2024,We evaluated this using GPT-3. 5 and GPT-4 with a multiple-choice question-and-answer (MCQA) benchmark.,19,"Multiple-choice,Math"
https://paperswithcode.com/paper/ader-a-comprehensive-benchmark-for-multi,ADer: A Comprehensive Benchmark for Multi-class Visual Anomaly Detection,zhangzjn/ader,https://github.com/zhangzjn/ader,5 Jun 2024,"This paper addresses this issue by proposing a comprehensive visual anomaly detection benchmark, \textbf{\textit{ADer}}, which is a modular framework that is highly extensible for new methods.",89,"Lesion Detection,Anomaly Detection"
https://paperswithcode.com/paper/lean-workbook-a-large-scale-lean-problem-set,Lean Workbook: A large-scale Lean problem set formalized from natural language math problems,internlm/internlm-math,https://github.com/internlm/internlm-math,6 Jun 2024,Our results indicate that the synthetic data pipeline can provide useful training data and improve the performance of LLMs in translating and understanding complex mathematical problems and proofs.,326,"Math,Automated Theorem Proving"
https://paperswithcode.com/paper/deep-learning-for-camera-calibration-and,Deep Learning for Camera Calibration and Beyond: A Survey,kangliao929/awesome-deep-camera-calibration,https://github.com/kangliao929/awesome-deep-camera-calibration,19 Mar 2023,"In this paper, we provide a comprehensive survey of learning-based camera calibration techniques, by analyzing their strengths and limitations.",461,Camera Calibration
https://paperswithcode.com/paper/itransformer-inverted-transformers-are,iTransformer: Inverted Transformers Are Effective for Time Series Forecasting,thuml/Time-Series-Library,https://github.com/thuml/Time-Series-Library,10 Oct 2023,"These forecasters leverage Transformers to model the global dependencies over temporal tokens of time series, with each token formed by multiple variates of the same timestamp.","4,793","Time Series Forecasting,Time Series"
https://paperswithcode.com/paper/lumina-t2x-transforming-text-into-any,"Lumina-T2X: Transforming Text into Any Modality, Resolution, and Duration via Flow-based Large Diffusion Transformers",alpha-vllm/lumina-t2x,https://github.com/alpha-vllm/lumina-t2x,9 May 2024,"Sora unveils the potential of scaling Diffusion Transformer for generating photorealistic images and videos at arbitrary resolutions, aspect ratios, and durations, yet it still lacks sufficient implementation details.","1,336",Other
https://paperswithcode.com/paper/audio-flamingo-a-novel-audio-language-model,Audio Flamingo: A Novel Audio Language Model with Few-Shot Learning and Dialogue Abilities,NVIDIA/audio-flamingo,https://github.com/NVIDIA/audio-flamingo,2 Feb 2024,Augmenting large language models (LLMs) to understand audio -- including non-speech sounds and non-verbal speech -- is critically important for diverse real-world applications of LLMs.,24,"Few-Shot Learning,Acoustic Scene Classification"
https://paperswithcode.com/paper/turning-whisper-into-real-time-transcription,Turning Whisper into Real-Time Transcription System,ufal/whisper_streaming,https://github.com/ufal/whisper_streaming,27 Jul 2023,"Whisper is one of the recent state-of-the-art multilingual speech recognition and translation models, however, it is not designed for real time transcription.","1,278","Speech Recognition,speech-recognition"
https://paperswithcode.com/paper/open-yolo-3d-towards-fast-and-accurate-open,Open-YOLO 3D: Towards Fast and Accurate Open-Vocabulary 3D Instance Segmentation,aminebdj/openyolo3d,https://github.com/aminebdj/openyolo3d,4 Jun 2024,"To this end, we propose a fast yet accurate open-vocabulary 3D instance segmentation approach, named Open-YOLO 3D, that effectively leverages only 2D object detection from multi-view RGB images for open-vocabulary 3D instance segmentation.",24,"object-detection,3D Instance Segmentation"
https://paperswithcode.com/paper/audio-mamba-bidirectional-state-space-model,Audio Mamba: Bidirectional State Space Model for Audio Representation Learning,mhamzaerol/audio-mamba-aum,https://github.com/mhamzaerol/audio-mamba-aum,5 Jun 2024,"Transformers have rapidly become the preferred choice for audio classification, surpassing methods based on CNNs.",19,"Representation Learning,Audio Classification"
