url,title,github-author,github-link,date,abstract,star,tasks
https://paperswithcode.com/paper/easyspider-a-no-code-visual-system-for,EasySpider: A No-Code Visual System for Crawling the Web,NaiboWang/EasySpider,https://github.com/NaiboWang/EasySpider,,"As such, web-crawling is an essential tool for both computational and non-computational scientists to conduct research.","27,413","Marketing,Data Integration"
https://paperswithcode.com/paper/pruner-zero-evolving-symbolic-pruning-metric,Pruner-Zero: Evolving Symbolic Pruning Metric from scratch for Large Language Models,pprp/pruner-zero,https://github.com/pprp/pruner-zero,5 Jun 2024,"In particular, we devise an elaborate search space encompassing the existing pruning metrics to discover the potential symbolic pruning metric.",26,Language Modelling
https://paperswithcode.com/paper/text-to-image-rectified-flow-as-plug-and-play,Text-to-Image Rectified Flow as Plug-and-Play Priors,yangxiaofeng/rectified_flow_prior,https://github.com/yangxiaofeng/rectified_flow_prior,5 Jun 2024,"Besides the generative capabilities of diffusion priors, motivated by the unique time-symmetry properties of rectified flow models, a variant of our method can additionally perform image inversion.",21,"Text to 3D,3D Generation"
https://paperswithcode.com/paper/how-abilities-in-large-language-models-are,How Abilities in Large Language Models are Affected by Supervised Fine-tuning Data Composition,wangrongsheng/caregpt,https://github.com/wangrongsheng/caregpt,9 Oct 2023,"We propose four intriguing research questions to explore the association between model performance and various factors including data amount, composition ratio, model size and SFT strategies.",587,"Instruction Following,Code Generation"
https://paperswithcode.com/paper/mathematical-supplement-for-the-texttt-gsplat,Mathematical Supplement for the $\texttt{gsplat}$ Library,nerfstudio-project/gsplat,https://github.com/nerfstudio-project/gsplat,4 Dec 2023,"This report provides the mathematical details of the gsplat library, a modular toolbox for efficient differentiable Gaussian splatting, as proposed by Kerbl et al.",957,Other
https://paperswithcode.com/paper/looking-backward-streaming-video-to-video,Looking Backward: Streaming Video-to-Video Translation with Feature Banks,Jeff-LiangF/streamv2v,https://github.com/Jeff-LiangF/streamv2v,24 May 2024,"This paper introduces StreamV2V, a diffusion model that achieves real-time streaming video-to-video (V2V) translation with user prompts.",305,Translation
https://paperswithcode.com/paper/prometheus-2-an-open-source-language-model,Prometheus 2: An Open Source Language Model Specialized in Evaluating Other Language Models,prometheus-eval/prometheus-eval,https://github.com/prometheus-eval/prometheus-eval,2 May 2024,Proprietary LMs such as GPT-4 are often employed to assess the quality of responses from various LMs.,602,Language Modelling
https://paperswithcode.com/paper/tetrahedron-splatting-for-3d-generation,Tetrahedron Splatting for 3D Generation,fudan-zvg/tet-splatting,https://github.com/fudan-zvg/tet-splatting,3 Jun 2024,"Using a signed distance field and Marching Tetrahedra, DMTet allows for precise mesh extraction and real-time rendering but is limited in handling large topological changes in meshes, leading to optimization challenges.",78,3D Generation
https://paperswithcode.com/paper/a-challenger-to-gpt-4v-early-explorations-of,A Challenger to GPT-4V? Early Explorations of Gemini in Visual Expertise,bradyfu/awesome-multimodal-large-language-models,https://github.com/bradyfu/awesome-multimodal-large-language-models,19 Dec 2023,"They endow Large Language Models (LLMs) with powerful capabilities in visual understanding, enabling them to tackle diverse multi-modal tasks.","9,901",Visual Reasoning
https://paperswithcode.com/paper/hanet-a-hierarchical-attention-network-for,HANet: A Hierarchical Attention Network for Change Detection With Bitemporal Very-High-Resolution Remote Sensing Images,faceonlive/ai-research,https://gitlab.com/faceonlive/ai-research,14 Apr 2024,"Benefiting from the developments in deep learning technology, deep-learning-based algorithms employing automatic feature extraction have achieved remarkable performance on the change detection (CD) task.",294,Change Detection
